{
  "$schema": "http://json-schema.org/draft-07/schema#",
  "title": "OpenTestApi Json Schema Version 0.1",
  "type": "object",
  "properties": {
    "testapi": {
      "type": "string",
      "description": "Specifies the TestAPI version."
    },
    "id": {
      "type": "string",
      "description": "Identifier of the test case."
    },
    "description": {
      "type": "string",
      "description": "The informal description of the test case."
    },
    "injections": {
      "type": "array",
      "items": {
        "type": "object",
        "properties": {
          "injectid": {
            "type": "string"
          },
          "service": {
            "type": "object",
            "properties": {
              "type": {
                "type": "string"
              },
              "connectstring": {
                "type": "string"
              },
              "username": {
                "type": "string"
              },
              "password": {
                "type": "string"
              },
              "custom": {
                "type": "object",
                "properties": {
                  "topic": {
                    "type": "string"
                  },
                  "group": {
                    "type": "string"
                  },
                  "method": {
                    "type": "string"
                  }
                }
              }
            },
            "required": [
              "type",
              "connectstring"
            ]
          },
          "checks": {
            "type": "array",
            "items": {
              "type": "string"
            }
          },
          "cron": {
            "type": "array",
            "items": {
              "type": "string"
            }
          },
          "timetolive": {
            "type": "string"
          },
          "sourcefile": {
            "type": "string"
          },
          "replacements": {
            "type": "array",
            "items": {
              "type": "object",
              "properties": {
                "key": {
                  "type": "string"
                },
                "value": {
                  "type": "array",
                  "items": {
                    "type": "object",
                    "properties": {
                      "order": {
                        "type": "integer",
                        "minimum": 0
                      },
                      "list": {
                        "type": "string"
                      },
                      "regex": {
                        "type": "string"
                      }
                    },
                    "required": [
                      "order"
                    ]
                  }
                },
                "maxlength": {
                  "type": "integer",
                  "minimum": 0
                }
              }
            },
            "minItems": 1,
            "uniqueItems": true
          }
        },
        "required": [
          "injectid",
          "service",
          "checks",
          "sourcefile"
        ]
      },
      "minItems": 1,
      "uniqueItems": true
    },
    "checks": {
      "type": "array",
      "items": {
        "type": "object",
        "properties": {
          "checkid": {
            "type": "string"
          },
          "service": {
            "type": "object",
            "properties": {
              "type": {
                "type": "string"
              },
              "connectstring": {
                "type": "string"
              },
              "username": {
                "type": "string"
              },
              "password": {
                "type": "string"
              },
              "custom": {
                "type": "object",
                "properties": {
                  "topic": {
                    "type": "string"
                  },
                  "group": {
                    "type": "string"
                  },
                  "method": {
                    "type": "string"
                  }
                }
              }
            },
            "required": [
              "type",
              "connectstring"
            ]
          },
          "expectedfile": {
            "type": "string"
          },
          "checktype": {
            "enum": ["equals", "contains"]
          },
          "maxwaitime": {
            "type": "string"
          },
          "active": {
            "type": "string"
          }
        },
        "required": [
          "checkid",
          "service",
          "expectedfile",
          "checktype"
        ]
      },
      "minItems": 1,
      "uniqueItems": true
    }
  },
  "required": [
    "testapi",
    "id",
    "description"
  ]
}