{
  "testapi": "0.1",
  "id": "myproject:myexampleapplication:E2E:test1",
  "description" : "a hello world test project",
  "injections" : [
    {
      "injectid" : "myinjectID",
      "service" : {
        "type": "kafka",
        "connectstring":"http://mykafkabroker.com",
        "username": "myusername",
        "password": "dW5zZWN1cmUgcGFzc3dvcmQ=",
        "custom": {
          "topic": "mytopic",
          "group": "mygroup",
          "method": "post"
        }
      },
      "checks" : [
        "mycheck1",
        "mycheck2"
      ],
      "cron": [
        "5 * * * * ?" ,
        "15 * * * * ?"
      ],
      "timetolive": "60s",
      "sourcefile" : "testcase1/mysourcefile.txt",
      "replacements" : [
        {
          "key" : "#key1#",
          "value": [{
            "order": 1,
            "list": "v1_0|v2_|v3_|v5_00"
          },{
            "order": 2,
            "regex": "^[0-9]{2}$"
          }],
          "maxlength":5
        }
      ]
    }
  ],
  "checks" : [
    {
      "checkid" : "mycheckid1",
      "service" : {
        "type": "kafka",
        "connectstring":"http://mykafkabroker.com",
        "username": "myusername",
        "password": "dW5zZWN1cmUgcGFzc3dvcmQ=",
        "custom": {
          "topic": "mytopic",
          "group": "mygroup",
          "method": "post"
        }
      },
      "expectedfile" : "testcase1/myresultfile.txt",
      "checktype" : "equals",
      "maxwaitime" : "60s",
      "active" : "true"
    }
  ]
}
